{
  "Aluno" : {
    "Id" : "str1234" ,
    "Matricula" : "str1234" ,
    "Nome" : "str1234" ,
    "Periodo" : "str1234" ,
    "Sala" : "str1234" ,
    "Turma" : "str1234" ,
    "User" : "str1234"
  } ,
  "Aviso" : {
    "Content" : "str1234" ,
    "Id" : "str1234" ,
    "Title" : "str1234"
  } ,
  "Enviado" : true ,
  "Lido" : true ,
  "Id" : "str1234"
}